<?xml version="1.0" encoding="UTF-8"?>
<Scenario xmlns:xsi="http://www.w3.org/2001/XMLSchema-instance" xsi:noNamespaceSchemaLocation="smpSchema.xsd">
  <name>DummyData_3Dim</name>
  <desc>A very simple test of multi-dim SMP, using psuedonyms</desc>
  <prngSeed>03507583219545544127</prngSeed>
  
 <ModelParameters>
    <VictoryProbModel>Linear</VictoryProbModel>
    <PCEModel>MarkovIncentive</PCEModel>
    <StateTransitions>Deterministic</StateTransitions> 
    
    <VotingRule>PropCbc</VotingRule>
    <BigRAdjust>OneThird</BigRAdjust>
    <BigRRange>Mid</BigRRange>
    <ThirdPartyCommit>SemiCommit</ThirdPartyCommit>
    <InterVecBrgn>S2P2</InterVecBrgn>
    <BargnModel>InitOnlyInterp</BargnModel>
  </ModelParameters>
  
  <Dimensions>
    <dName>FirstDim</dName>
    <dName>SecondDim</dName>
    <dName>YADN</dName>
  </Dimensions>
  
  <Actors>
    <Actor>
      <name>Alice</name>
      <description>One of the SMP actors</description>
      <capability>72.2</capability>
      <Position>
        <dCoord>42.1</dCoord>
        <dCoord>15.7</dCoord>
      </Position>
      <Salience>
        <dSal>83.8</dSal>
        <dSal>97.2</dSal>
      </Salience>
    </Actor>
    
    <Actor>
      <name>Bob</name>
      <description>The second SMP actor</description>
      <capability>72.2</capability>
      <Position>
        <dCoord>42.1</dCoord>
        <dCoord>15.7</dCoord>
      </Position>
      <Salience>
        <dSal>83.8</dSal>
        <dSal>97.2</dSal>
      </Salience>
    </Actor>
    
    <Actor>
      <name>Carol</name>
      <description>Third SMP actor</description>
      <capability>72.2</capability>
      <Position>
        <dCoord>42.1</dCoord>
        <dCoord>15.7</dCoord>
      </Position>
      <Salience>
        <dSal>83.8</dSal>
        <dSal>97.2</dSal>
      </Salience>
    </Actor>
    
    <Actor>
      <name>David</name>
      <description>Fourth SMP actor</description>
      <capability>63.8</capability>
      <Position>
        <dCoord>55.9</dCoord>
        <dCoord>39.8</dCoord>
      </Position>
      <Salience>
        <dSal>11.2</dSal>
        <dSal>63.8</dSal>
      </Salience>
    </Actor>
    
  </Actors>
  
  
  <IdealAdjustment>
    <iaPair>
      <adjustingIdeal>Alice</adjustingIdeal>
      <referencePos>Alice</referencePos>
      <adjust>0.87</adjust>
    </iaPair>
    
    <iaPair>
      <adjustingIdeal>Bob</adjustingIdeal>
      <referencePos>Bob</referencePos>
      <adjust>0.75</adjust>
    </iaPair>
    
    <iaPair>
      <adjustingIdeal>Bob</adjustingIdeal>
      <referencePos>Alice</referencePos>
      <adjust>0.07</adjust>
    </iaPair>
    
    
    <iaPair>
      <adjustingIdeal>Carol</adjustingIdeal>
      <referencePos>Carol</referencePos>
      <adjust>0.65</adjust>
    </iaPair>
    
    
    <iaPair>
      <adjustingIdeal>Carol</adjustingIdeal>
      <referencePos>David</referencePos>
      <adjust>0.13</adjust>
    </iaPair>
    
    
    <iaPair>
      <adjustingIdeal>David</adjustingIdeal>
      <referencePos>David</referencePos>
      <adjust>0.57</adjust>
    </iaPair>
  </IdealAdjustment>
</Scenario>
